{
  "video_id": "2026-05-14_tiktok_7637541285963812126",
  "source": {
    "video_path": "/Users/chaiyapeng/Downloads/26/TikVideo.App_7637541285963812126.mp4",
    "analysis_path": "skills/shuke-product/vault/analyses/2026-05-14_tiktok_7637541285963812126/analysis.md",
    "model": "gemini-3.1-pro-preview",
    "duration_seconds": 80.4,
    "created_at": "2026-05-14"
  },
  "product": {
    "name": "Madebut 品牌的 21V 重型无刷电动冲击扳手（包含双电池及全套配件的工具箱）",
    "category": "家居清洁",
    "sub_category": "",
    "price_position": "",
    "target_audience": [],
    "confidence": 0.7
  },
  "tags": {
    "product_tags": [
      "家居清洁"
    ],
    "video_type_tags": [
      "测评对比",
      "效果前后对比",
      "UGC口播",
      "质地实测",
      "场景种草",
      "开箱展示",
      "清仓福利",
      "价格刺激",
      "痛点解决"
    ],
    "hook_tags": [
      "价格跳水",
      "结果前置",
      "好奇悬念",
      "低价占便宜",
      "场景冲突",
      "限时稀缺",
      "尴尬痛点"
    ],
    "proof_tags": [
      "产品特写",
      "第三方背书",
      "前后对比",
      "尺寸容量",
      "使用场景"
    ],
    "audience_tags": [],
    "risk_tags": [
      "信任不足",
      "无CTA",
      "口播缺失",
      "功效宣称风险"
    ],
    "platform_tags": [
      "tiktok"
    ]
  },
  "hook": {
    "type": "结果前置展示 + ASMR听觉刺激",
    "first_3s_text": "",
    "mechanism": "",
    "retention_score": 0
  },
  "selling_points": [],
  "proof_points": [],
  "cta": {
    "text": "",
    "clarity": "none"
  },
  "scores": {
    "retention": 0.0,
    "clarity": 9.0,
    "trust": 8.0,
    "product_display": 9.5,
    "purchase_impulse": 8.5,
    "total": 8.8
  },
  "remake": {
    "angle": "",
    "script_outline": [],
    "shot_list": [],
    "voiceover": "",
    "subtitles": [],
    "ai_image_prompts": [],
    "ai_video_prompts": []
  },
  "search_text": "产品：Madebut 品牌的 21V 重型无刷电动冲击扳手（包含双电池及全套配件的工具箱）。品类：家居清洁。视频类型：测评对比、效果前后对比、UGC口播。钩子：价格跳水、尴尬痛点、结果前置，。风险：无CTA、口播缺失、信任不足。评分：8.8"
}