{
  "video_id": "2026-05-14_tiktok_7627492667898875144",
  "source": {
    "video_path": "/Users/chaiyapeng/Downloads/tabcut_videos/321_hpm2s6_7627492667898875144.mp4",
    "analysis_path": "skills/shuke-product/vault/analyses/2026-05-14_tiktok_7627492667898875144/analysis.md",
    "model": "gemini-3.1-pro-preview",
    "duration_seconds": 15.1,
    "created_at": "2026-05-14"
  },
  "product": {
    "name": "",
    "category": "家居清洁",
    "sub_category": "",
    "price_position": "",
    "target_audience": [],
    "confidence": 0.6
  },
  "tags": {
    "product_tags": [
      "家居清洁"
    ],
    "video_type_tags": [
      "其他"
    ],
    "hook_tags": [
      "反面教材/痛点共鸣型钩子"
    ],
    "proof_tags": [],
    "audience_tags": [],
    "risk_tags": [
      "无CTA",
      "信任不足"
    ],
    "platform_tags": [
      "tiktok"
    ]
  },
  "hook": {
    "type": "反面教材/痛点共鸣型钩子",
    "first_3s_text": "",
    "mechanism": "",
    "retention_score": 0
  },
  "selling_points": [],
  "proof_points": [],
  "cta": {
    "text": "",
    "clarity": "none"
  },
  "scores": {
    "retention": 0,
    "clarity": 0,
    "trust": 0,
    "product_display": 0,
    "purchase_impulse": 0,
    "total": 8.8
  },
  "remake": {
    "angle": "",
    "script_outline": [],
    "shot_list": [],
    "voiceover": "",
    "subtitles": [],
    "ai_image_prompts": [],
    "ai_video_prompts": []
  },
  "search_text": "产品：未知。品类：家居清洁。人群：。钩子：反面教材/痛点共鸣型钩子。评分：8.8"
}