{
  "video_id": "2026-05-14_tiktok_7630529670580030727",
  "source": {
    "video_path": "/Users/chaiyapeng/Downloads/tabcut_videos/470_xime_luis_7630529670580030727.mp4",
    "analysis_path": "skills/shuke-product/vault/analyses/2026-05-14_tiktok_7630529670580030727/analysis.md",
    "model": "gemini-3.1-pro-preview",
    "duration_seconds": 14.2,
    "created_at": "2026-05-14"
  },
  "product": {
    "name": "漫威周边——带有机械眨眼功能的蜘蛛侠头套/面具",
    "category": "男士护理",
    "sub_category": "",
    "price_position": "",
    "target_audience": [
      "漫威粉丝、年轻男性、Cosplay爱好者、寻找搞怪/创意礼物的年轻情侣"
    ],
    "confidence": 0.6
  },
  "tags": {
    "product_tags": [
      "男士护理"
    ],
    "video_type_tags": [
      "其他"
    ],
    "hook_tags": [
      "情绪冲突钩（情侣矛盾） + 悬念盲盒钩（猎奇穿搭）"
    ],
    "proof_tags": [],
    "audience_tags": [
      "漫威粉丝、年轻男性、Cosplay爱好者、寻找搞怪/创意礼物的年轻情侣"
    ],
    "risk_tags": [
      "无CTA",
      "口播缺失",
      "信任不足"
    ],
    "platform_tags": [
      "tiktok"
    ]
  },
  "hook": {
    "type": "情绪冲突钩（情侣矛盾） + 悬念盲盒钩（猎奇穿搭）",
    "first_3s_text": "",
    "mechanism": "",
    "retention_score": 0
  },
  "selling_points": [],
  "proof_points": [],
  "cta": {
    "text": "",
    "clarity": "none"
  },
  "scores": {
    "retention": 0,
    "clarity": 0,
    "trust": 0,
    "product_display": 0,
    "purchase_impulse": 0,
    "total": 8.6
  },
  "remake": {
    "angle": "",
    "script_outline": [],
    "shot_list": [],
    "voiceover": "",
    "subtitles": [],
    "ai_image_prompts": [],
    "ai_video_prompts": []
  },
  "search_text": "产品：漫威周边——带有机械眨眼功能的蜘蛛侠头套/面具。品类：男士护理。人群：漫威粉丝、年轻男性、Cosplay爱好者、寻找搞怪/创意礼物的年轻情侣。钩子：情绪冲突钩（情侣矛盾） + 悬念盲盒钩（猎奇穿搭）。评分：8.6"
}