{
  "video_id": "2026-05-14_tiktok_7636199219954519327",
  "source": {
    "video_path": "/Users/chaiyapeng/Downloads/26/TikVideo.App_7636199219954519327.mp4",
    "analysis_path": "skills/shuke-product/vault/analyses/2026-05-14_tiktok_7636199219954519327/analysis.md",
    "model": "gemini-3.1-pro-preview",
    "duration_seconds": 37.0,
    "created_at": "2026-05-14"
  },
  "product": {
    "name": "8合1长柄电动清洁刷（视频结尾明确口播提及 \"8-in-1 electric brush\"）",
    "category": "家居清洁",
    "sub_category": "",
    "price_position": "",
    "target_audience": [],
    "confidence": 0.7
  },
  "tags": {
    "product_tags": [
      "家居清洁"
    ],
    "video_type_tags": [
      "测评对比",
      "效果前后对比",
      "UGC口播",
      "质地实测",
      "场景种草",
      "价格刺激",
      "痛点解决"
    ],
    "hook_tags": [
      "好奇悬念",
      "场景冲突",
      "尴尬痛点",
      "结果前置"
    ],
    "proof_tags": [
      "前后对比",
      "第三方背书"
    ],
    "audience_tags": [],
    "risk_tags": [
      "信任不足",
      "无CTA"
    ],
    "platform_tags": [
      "tiktok"
    ]
  },
  "hook": {
    "type": "痛点共鸣 + 视觉解压",
    "first_3s_text": "",
    "mechanism": "",
    "retention_score": 8
  },
  "selling_points": [],
  "proof_points": [],
  "cta": {
    "text": "",
    "clarity": "none"
  },
  "scores": {
    "retention": 8.0,
    "clarity": 7.0,
    "trust": 6.0,
    "product_display": 9.0,
    "purchase_impulse": 5.0,
    "total": 7.0
  },
  "remake": {
    "angle": "",
    "script_outline": [],
    "shot_list": [],
    "voiceover": "",
    "subtitles": [],
    "ai_image_prompts": [],
    "ai_video_prompts": []
  },
  "search_text": "产品：8合1长柄电动清洁刷（视频结尾明确口播提及 \"8-in-1 electric brush\"）。品类：家居清洁。视频类型：测评对比、效果前后对比、UGC口播。钩子：尴尬痛点、结果前置、好奇悬念，。风险：无CTA、信任不足。评分：7.0"
}