{
  "video_id": "2026-05-14_tiktok_7637894539675471125",
  "source": {
    "video_path": "/Users/chaiyapeng/Downloads/tabcut_videos/327_xhjykj11192_7637894539675471125.mp4",
    "analysis_path": "skills/shuke-product/vault/analyses/2026-05-14_tiktok_7637894539675471125/analysis.md",
    "model": "gemini-3.1-pro-preview",
    "duration_seconds": 10.1,
    "created_at": "2026-05-14"
  },
  "product": {
    "name": "一款印有“BE YOUR STYLE”字样的大容量、防泼水黑色休闲/电脑双肩背包",
    "category": "数码配件",
    "sub_category": "",
    "price_position": "",
    "target_audience": [
      "学生党、通勤上班族、短途旅行者，以及注重实用性与街头休闲穿搭的年轻群体"
    ],
    "confidence": 0.6
  },
  "tags": {
    "product_tags": [
      "数码配件"
    ],
    "video_type_tags": [
      "其他"
    ],
    "hook_tags": [
      "动作钩子（暴力开箱） + 悬念钩子（大箱子里装了什么）"
    ],
    "proof_tags": [],
    "audience_tags": [
      "学生党、通勤上班族、短途旅行者，以及注重实用性与街头休闲穿搭的年轻群体"
    ],
    "risk_tags": [
      "无CTA",
      "信任不足"
    ],
    "platform_tags": [
      "tiktok"
    ]
  },
  "hook": {
    "type": "动作钩子（暴力开箱） + 悬念钩子（大箱子里装了什么）",
    "first_3s_text": "",
    "mechanism": "",
    "retention_score": 0
  },
  "selling_points": [],
  "proof_points": [],
  "cta": {
    "text": "",
    "clarity": "none"
  },
  "scores": {
    "retention": 0,
    "clarity": 0,
    "trust": 0,
    "product_display": 0,
    "purchase_impulse": 0,
    "total": 9.0
  },
  "remake": {
    "angle": "",
    "script_outline": [],
    "shot_list": [],
    "voiceover": "",
    "subtitles": [],
    "ai_image_prompts": [],
    "ai_video_prompts": []
  },
  "search_text": "产品：一款印有“BE YOUR STYLE”字样的大容量、防泼水黑色休闲/电脑双肩背包。品类：数码配件。人群：学生党、通勤上班族、短途旅行者，以及注重实用性与街头休闲穿搭的年轻群体。钩子：动作钩子（暴力开箱） + 悬念钩子（大箱子里装了什么）。评分：9.0"
}