{
  "video_id": "2026-05-14_tiktok_7617768231725567253",
  "source": {
    "video_path": "/Users/chaiyapeng/Downloads/tabcut_videos/113_acpyo64rb0_7617768231725567253.mp4",
    "analysis_path": "skills/shuke-product/vault/analyses/2026-05-14_tiktok_7617768231725567253/analysis.md",
    "model": "gemini-3.1-pro-preview",
    "duration_seconds": 19.7,
    "created_at": "2026-05-14"
  },
  "product": {
    "name": "一款主打超强减震、透气且带有按摩凸点的高弹力加厚鞋垫（爆款踩屎感鞋垫）",
    "category": "服饰穿搭",
    "sub_category": "",
    "price_position": "",
    "target_audience": [
      "长时间站立工作者、受脚部酸痛困扰的人群、运动爱好者以及寻找鞋子舒适度平替的用户"
    ],
    "confidence": 0.6
  },
  "tags": {
    "product_tags": [
      "服饰穿搭"
    ],
    "video_type_tags": [
      "其他"
    ],
    "hook_tags": [
      "痛点提问（文案） + 极致感官刺激（视觉）"
    ],
    "proof_tags": [],
    "audience_tags": [
      "长时间站立工作者、受脚部酸痛困扰的人群、运动爱好者以及寻找鞋子舒适度平替的用户"
    ],
    "risk_tags": [
      "信任不足"
    ],
    "platform_tags": [
      "tiktok"
    ]
  },
  "hook": {
    "type": "痛点提问（文案） + 极致感官刺激（视觉）",
    "first_3s_text": "",
    "mechanism": "",
    "retention_score": 0
  },
  "selling_points": [],
  "proof_points": [],
  "cta": {
    "text": "打消适用性顾虑（可放入普通运动鞋），制造稀缺感（限时），促单",
    "clarity": "clear"
  },
  "scores": {
    "retention": 0,
    "clarity": 0,
    "trust": 0,
    "product_display": 0,
    "purchase_impulse": 0,
    "total": 8.2
  },
  "remake": {
    "angle": "",
    "script_outline": [],
    "shot_list": [],
    "voiceover": "",
    "subtitles": [],
    "ai_image_prompts": [],
    "ai_video_prompts": []
  },
  "search_text": "产品：一款主打超强减震、透气且带有按摩凸点的高弹力加厚鞋垫（爆款踩屎感鞋垫）。品类：服饰穿搭。人群：长时间站立工作者、受脚部酸痛困扰的人群、运动爱好者以及寻找鞋子舒适度平替的用户。钩子：痛点提问（文案） + 极致感官刺激（视觉）。评分：8.2"
}