{
  "video_id": "2026-05-14_tiktok_7626956724154567956",
  "source": {
    "video_path": "/Users/chaiyapeng/Downloads/tabcut_videos/341__confetticorner_7626956724154567956.mp4",
    "analysis_path": "skills/shuke-product/vault/analyses/2026-05-14_tiktok_7626956724154567956/analysis.md",
    "model": "gemini-3.1-pro-preview",
    "duration_seconds": 50.0,
    "created_at": "2026-05-14"
  },
  "product": {
    "name": "",
    "category": "美妆护肤",
    "sub_category": "",
    "price_position": "",
    "target_audience": [],
    "confidence": 0.6
  },
  "tags": {
    "product_tags": [
      "美妆护肤"
    ],
    "video_type_tags": [
      "其他"
    ],
    "hook_tags": [],
    "proof_tags": [],
    "audience_tags": [],
    "risk_tags": [
      "信任不足"
    ],
    "platform_tags": [
      "tiktok"
    ]
  },
  "hook": {
    "type": "",
    "first_3s_text": "",
    "mechanism": "",
    "retention_score": 0
  },
  "selling_points": [],
  "proof_points": [],
  "cta": {
    "text": "“扔掉破塑料袋，像米其林大厨一样做甜点！”",
    "clarity": "clear"
  },
  "scores": {
    "retention": 0,
    "clarity": 0,
    "trust": 0,
    "product_display": 0,
    "purchase_impulse": 0,
    "total": 9.0
  },
  "remake": {
    "angle": "",
    "script_outline": [],
    "shot_list": [],
    "voiceover": "",
    "subtitles": [],
    "ai_image_prompts": [],
    "ai_video_prompts": []
  },
  "search_text": "产品：未知。品类：美妆护肤。人群：。钩子：。评分：9.0"
}