{
  "video_id": "2026-05-14_tiktok_7633303938489421074",
  "source": {
    "video_path": "/Users/chaiyapeng/Downloads/tabcut_videos/118_nu61tc_7633303938489421074.mp4",
    "analysis_path": "skills/shuke-product/vault/analyses/2026-05-14_tiktok_7633303938489421074/analysis.md",
    "model": "gemini-3.1-pro-preview",
    "duration_seconds": 10.1,
    "created_at": "2026-05-14"
  },
  "product": {
    "name": "高筒防水防泥防滑鞋套（带拉链、绑带及反光条）",
    "category": "家居清洁",
    "sub_category": "",
    "price_position": "",
    "target_audience": [
      "雨季通勤者、骑行/摩托车爱好者、户外运动人群、学生及外卖/快递从业者"
    ],
    "confidence": 0.6
  },
  "tags": {
    "product_tags": [
      "家居清洁"
    ],
    "video_type_tags": [
      "其他"
    ],
    "hook_tags": [
      "开箱展示型 + 悬念型（从袋子里拿出一坨黑色的东西，让人好奇是什么）"
    ],
    "proof_tags": [],
    "audience_tags": [
      "雨季通勤者、骑行/摩托车爱好者、户外运动人群、学生及外卖/快递从业者"
    ],
    "risk_tags": [
      "无CTA",
      "信任不足"
    ],
    "platform_tags": [
      "tiktok"
    ]
  },
  "hook": {
    "type": "开箱展示型 + 悬念型（从袋子里拿出一坨黑色的东西，让人好奇是什么）",
    "first_3s_text": "",
    "mechanism": "",
    "retention_score": 0
  },
  "selling_points": [],
  "proof_points": [],
  "cta": {
    "text": "",
    "clarity": "none"
  },
  "scores": {
    "retention": 0,
    "clarity": 0,
    "trust": 0,
    "product_display": 0,
    "purchase_impulse": 0,
    "total": 8.2
  },
  "remake": {
    "angle": "",
    "script_outline": [],
    "shot_list": [],
    "voiceover": "",
    "subtitles": [],
    "ai_image_prompts": [],
    "ai_video_prompts": []
  },
  "search_text": "产品：高筒防水防泥防滑鞋套（带拉链、绑带及反光条）。品类：家居清洁。人群：雨季通勤者、骑行/摩托车爱好者、户外运动人群、学生及外卖/快递从业者。钩子：开箱展示型 + 悬念型（从袋子里拿出一坨黑色的东西，让人好奇是什么）。评分：8.2"
}