{
  "video_id": "2026-05-14_tiktok_7635156846092799239",
  "source": {
    "video_path": "/Users/chaiyapeng/Downloads/tabcut_videos/155_xxx16.08_7635156846092799239.mp4",
    "analysis_path": "skills/shuke-product/vault/analyses/2026-05-14_tiktok_7635156846092799239/analysis.md",
    "model": "gemini-3.1-pro-preview",
    "duration_seconds": 44.1,
    "created_at": "2026-05-14"
  },
  "product": {
    "name": "",
    "category": "身体护理",
    "sub_category": "",
    "price_position": "",
    "target_audience": [],
    "confidence": 0.6
  },
  "tags": {
    "product_tags": [
      "身体护理"
    ],
    "video_type_tags": [
      "其他"
    ],
    "hook_tags": [
      "商品直拍型 + 颜值暴击"
    ],
    "proof_tags": [],
    "audience_tags": [],
    "risk_tags": [
      "无CTA",
      "口播缺失",
      "信任不足"
    ],
    "platform_tags": [
      "tiktok"
    ]
  },
  "hook": {
    "type": "商品直拍型 + 颜值暴击",
    "first_3s_text": "",
    "mechanism": "",
    "retention_score": 0
  },
  "selling_points": [],
  "proof_points": [],
  "cta": {
    "text": "",
    "clarity": "none"
  },
  "scores": {
    "retention": 0,
    "clarity": 0,
    "trust": 0,
    "product_display": 0,
    "purchase_impulse": 0,
    "total": 7.6
  },
  "remake": {
    "angle": "",
    "script_outline": [],
    "shot_list": [],
    "voiceover": "",
    "subtitles": [],
    "ai_image_prompts": [],
    "ai_video_prompts": []
  },
  "search_text": "产品：未知。品类：身体护理。人群：。钩子：商品直拍型 + 颜值暴击。评分：7.6"
}