{
  "video_id": "2026-05-14_tiktok_7636111172567076116",
  "source": {
    "video_path": "/Users/chaiyapeng/Downloads/tabcut_videos/340_luishernandez77442_7636111172567076116.mp4",
    "analysis_path": "skills/shuke-product/vault/analyses/2026-05-14_tiktok_7636111172567076116/analysis.md",
    "model": "gemini-3.1-pro-preview",
    "duration_seconds": 10.1,
    "created_at": "2026-05-14"
  },
  "product": {
    "name": "一款极度便携的“胶囊/口袋”迷你遮阳挡雨两用伞（带遇水开花隐藏功能）",
    "category": "美妆护肤",
    "sub_category": "",
    "price_position": "",
    "target_audience": [
      "通勤族、女性用户、讨厌带重物出门的人、天气多变地区的居民"
    ],
    "confidence": 0.6
  },
  "tags": {
    "product_tags": [
      "美妆护肤"
    ],
    "video_type_tags": [
      "其他"
    ],
    "hook_tags": [
      "视觉反差钩 + 情绪/猎奇口播钩"
    ],
    "proof_tags": [],
    "audience_tags": [
      "通勤族、女性用户、讨厌带重物出门的人、天气多变地区的居民"
    ],
    "risk_tags": [
      "无CTA",
      "信任不足"
    ],
    "platform_tags": [
      "tiktok"
    ]
  },
  "hook": {
    "type": "视觉反差钩 + 情绪/猎奇口播钩",
    "first_3s_text": "",
    "mechanism": "",
    "retention_score": 0
  },
  "selling_points": [],
  "proof_points": [],
  "cta": {
    "text": "",
    "clarity": "none"
  },
  "scores": {
    "retention": 0,
    "clarity": 0,
    "trust": 0,
    "product_display": 0,
    "purchase_impulse": 0,
    "total": 3.8
  },
  "remake": {
    "angle": "",
    "script_outline": [],
    "shot_list": [],
    "voiceover": "",
    "subtitles": [],
    "ai_image_prompts": [],
    "ai_video_prompts": []
  },
  "search_text": "产品：一款极度便携的“胶囊/口袋”迷你遮阳挡雨两用伞（带遇水开花隐藏功能）。品类：美妆护肤。人群：通勤族、女性用户、讨厌带重物出门的人、天气多变地区的居民。钩子：视觉反差钩 + 情绪/猎奇口播钩。评分：3.8"
}