{
  "video_id": "2026-05-14_tiktok_7637461513850162440",
  "source": {
    "video_path": "/Users/chaiyapeng/Downloads/tabcut_videos/380_slnxajulia_7637461513850162440.mp4",
    "analysis_path": "skills/shuke-product/vault/analyses/2026-05-14_tiktok_7637461513850162440/analysis.md",
    "model": "gemini-3.1-pro-preview",
    "duration_seconds": 26.7,
    "created_at": "2026-05-14"
  },
  "product": {
    "name": "",
    "category": "其他",
    "sub_category": "",
    "price_position": "",
    "target_audience": [],
    "confidence": 0.6
  },
  "tags": {
    "product_tags": [
      "其他"
    ],
    "video_type_tags": [
      "其他"
    ],
    "hook_tags": [],
    "proof_tags": [],
    "audience_tags": [],
    "risk_tags": [
      "无CTA"
    ],
    "platform_tags": [
      "tiktok"
    ]
  },
  "hook": {
    "type": "",
    "first_3s_text": "",
    "mechanism": "",
    "retention_score": 0
  },
  "selling_points": [],
  "proof_points": [],
  "cta": {
    "text": "",
    "clarity": "none"
  },
  "scores": {
    "retention": 0,
    "clarity": 0,
    "trust": 0,
    "product_display": 0,
    "purchase_impulse": 0,
    "total": 0.0
  },
  "remake": {
    "angle": "",
    "script_outline": [],
    "shot_list": [],
    "voiceover": "",
    "subtitles": [],
    "ai_image_prompts": [],
    "ai_video_prompts": []
  },
  "search_text": "产品：未知。品类：其他。人群：。钩子：。评分：0.0"
}